{
  "contract_version": "0.15.0",
  "fusion_id": "6f1f8a3e-2b1c-4d5e-9a7b-3c4d5e6f7a8b",
  "group_id": "g1",
  "created_at": "2026-12-01T18:50:00Z",
  "cameras": [
    {
      "camera_id": "cam1",
      "session_id": "0b9d6c1e-7f2a-4b3c-8d4e-5f6a7b8c9d0e",
      "run_id": "1a2b3c4d-5e6f-4a7b-8c9d-0e1f2a3b4c5d",
      "t0_wall": "2026-12-01T18:00:00.250Z",
      "t0_mono": 5000.25,
      "latency_median_s": 0.08
    },
    {
      "camera_id": "cam2",
      "session_id": "2c3d4e5f-6a7b-4c8d-9e0f-1a2b3c4d5e6f",
      "run_id": "3d4e5f6a-7b8c-4d9e-8f1a-2b3c4d5e6f7a",
      "t0_wall": "2026-12-01T18:00:00.410Z",
      "t0_mono": 5000.41,
      "latency_median_s": 0.095
    }
  ],
  "excluded": [],
  "params": {"match_distance_m": 0.5, "max_offset_s": 0.033, "step_s": 0.1},
  "gaps": [{"camera_id": "cam1", "start_t": 12.0, "end_t": 32.0}],
  "counts": {"players": 3, "merged_rows": 420, "single_camera_rows": 80, "differences": 14}
}
